id,categoryId,description,publishedAt,title,thmbnails,channelTitle,duration,caption,viewCount,likeCount,dislikeCount,favoriteCount,commentCount,subtitle
Hvv4e0ddttU,22,"Over One Million People Enroll in Online Crypto Class                                                                                                                                                                CNBC&#8217;s Senior Tech Reporter Ari Levy detailshow the world&#8217;s most popular cryptocurrency, bitcoin, with its acceptance explosion and staggering valuations, now seems to have opened an entire new educational universe. Swiss Vocational School Lucerne University Accepts Bitcoin for TuitionThanks to Bitcoin, Crypto Courses Aren&#8217;t Just for PhDsProfessor Dan Boneh of Stanford University Computer Security Lab discussed the attraction to his cryptography course, and how it is due to &#8220;the huge valuations in these currencies&#8221; such as bitcoin.  Second only to machine learning, Computer Security and Cryptography is a wildly popular course.  It&#8217;s also true bitcoin is &#8220;a wonderful way to teach cryptography&#8221; he told Mr.  Levy of CNBC.  The advent of cryptocurrencies means &#8220;there are a whole bunch of new applications for cryptography that didn&#8217;t exist before,&#8221; Professor Boneh added. Getting to cryptography through bitcoin has meant a renewed interest in the mathematical language.  Professor Boneh &#8220;said that more than 1 million people have signed up for an online cryptography class he teaches through the websiteCoursera,&#8221; CNBC reports.",2017-11-01T10:15:28Z,Over One Million People Enroll in Online Crypto Class - Bitcoin News,https://i.ytimg.com/vi/Hvv4e0ddttU/hqdefault.jpg,Bitcoin News 🔥,PT5M12S,false,32,0,0,0,0,over 1 million people enroll in online crypto class CNBC in number 8200 17 s senior tech reporter Arie levy detail show the world and number 8200 17 s most popular cryptocurrency Bitcoin with its acceptance explosion in staggering valuations now seems to have opened an entire new educational universe swiss vocational school lucerne university accepts Bitcoin for tuition thanks to Bitcoin crypto courses aren in number 8200 17 t just forfeits professor Dan Boneh of Stanford University computer security lab discussed thee attraction to his cryptography course and how it is due to in number 8220 the huge valuations in these currencies in number 8221 such as bitcoin second only the machine learning computer security and cryptography is a wildly popular course it in number 8200 17s also true bitcoin is a number 8220 a wonderful way to teach cryptography in number 8221 he told mr. levy of CNBC the advent of crypto currencies means a number 8220 there are a whole bunch of new applications for cryptography that di DN and number eight thousand two hundred seventeen t exists before and number eight thousand 221 professor Bona added getting to cryptography through Bitcoin has meant a renewed interest in the mathematical language professor Bona number 8220 said that more than 1 million people have signed up for an online cryptography class he teaches through the website Coursera and number 8221 CNBC reports professor Dan Boneh Coursera boasts nearly 30 million registered users in 2000 different courses in a dozen languages registered for professor Bona number 8200 17s course and found to immediate options 7900 USD would earn participants a certificate along with educational feedback while the free option allows auditors a chance to take such a course as a test driver just for the sake of knowledge financially it is available and number 8220 cryptography is an indispensable tool for protecting information in computer systems and number 8221 the introduction states the classes okay an in two parts including cryptographic systems secret keys public keys programming projects and zero knowledge even a textbook authored by Professor Bona and fipple Boyle of Carnegie Mellon is freely available and frequently updated for anyone to self learn cryptocurrency is a DIY project for students professor Goyal and number 8220 spent seven years at Microsoft research in India where he was working on new kinds of cloud encryption and number 8221 according to CNBC and number 8220 he recently helped start that mu crypto group and number 8221 mr. Levy explains and number 8220 to take on research projects and number 8221 the group includes Turing Award winner Manuel Bloom both professors explain how cryptocurrency prices such as Bitcoin reaching 600 USD recently have encouraged students to attempt similar projects of their own professor bonus data and number 8220 there are many experiments underway and just like in the rest of the startup ecosystem some will do well in some will fail and number 8221 with such a neck motioning market valuations it in number 8200 17 s inevitable students will leave formal academia professor boyle notes how if they in number 8220 want to start a mobile app you probably need some investor funding for crypto currencies if you start your own and if people are interested you automatically get funded by the value of what you created and number 8221 with valuations continuing to skyrocket rest assured more crypto courses are on the way both UC Berkeley and MIT have offered their versions 
hAT7vPhZrqQ,28,"Clip 5/5
Speaker: Yvo Desmedt · University College London, UK 

Shannon started the unclassified scientific research in cryptography with his
October 1949 paper. First we briefly survey the scientific research in
cryptography since then. We discuss the strengths and weaknesses of this
research, attempting to present a balanced viewpoint.

The lecture will also discuss the progress we have not made. We will show that
not everything in modern cryptography is rosy. Besides above examples, we will
also talk about the discrepancy between the massive number of applications of
cryptography studied by academics and the fact most of these are being viewed
as completely irrelevant to the real world. 

For more information go to the CERIAS website (http://bit.ly/dsFCBF)",2010-08-31T02:35:49Z,CERIAS Security: 60 years of scientific research in cryptography: a reflection 5/5,https://i.ytimg.com/vi/hAT7vPhZrqQ/hqdefault.jpg,Christiaan008,PT6M53S,false,96,0,0,0,0,this is something I've been talking about for a few years one of the problems we have and it's not simply in cryptography but across much of computing our reward system has skewed what research is all about so we have a system whereby funding goes to those who can solve problems that are needed right away the solutions are neither right away so government does that companies do that instead of promoting longer-term more fundamental research we want to see the results right away they're not willing to fund research that produces negative results and so and so we've gotten to the point where very conservative in the kinds of things that we're willing to propose we also see in in the arena of publications that there's greater and greater competition to have higher rankings or better publication rates and so we see more and more papers with less impressive results and as a field of computing in general we don't really encourage or reward negative results or attempts to reconfirm what others have done in the biological sciences or physical sciences they redo experiments to go we don't do that because there's no publication in it and there's no money no one will fund it and so we've developed a discipline that increasingly is more and more ad hoc results that look good at first blush and then nobody looks back because there's no reward for it so I agree with you completely but I would say it's actually a much broader problem then submitted approaches I mean when you think about the internet that our approach we could consider as for example making a database it's not the first time I thought about that I basically spoke about using databases to look at all the schemes protocols etc that have been developed and make it available on the internet but it was a different context it was in the context of actually checking whether the some scheme that is being now proposed is actually more complex than a trivial combination of existing schemes but that same database could be used to related to your question where people basically say I taught this proof in my class okay and I have answered all the questions of the students and so yes I'm going to take that I actually thought this proof in my class means that somebody has actually looked at it don't valid it quiet in details and then having the possibility of students who say I don't understand it oops that's a back okay so i remember when i was in montreal actually was teaching students about the fiat shamir protocol for identification and then the sun student in the class actually mentioned that some attack against that scheme which then became a paper of crypto so that would be one solution and just not necessarily limited only to this area it might be done in broader context where people basically attach their name saying this hell has been verified not necessarily said it's kind of a trust building a petrasis it doesn't necessarily say that it is good and I do realize that also follow metals are limited it's kind of little bit when you look at you talked electrical engineer they design circuits so that they become easier to verify and that's also an approach but yeah the funding is a big problem and I heard that National Science Foundation has been basically clobbered and that goes back to the bush administration that's actually very very sad I know yeah one of the problems with with any anything that pertains to security biet cryptography beat systems security bit even national defense is credit is societal credit is often how do you claim credit how do you get credit for what did not occur I used to have on my slides I used to have a citation to somebody who had an asset oops i put these guys a personal citation on my slides and i haven't asked him his permission and so i've emailed him and he didn't basically want this citation as actually he told me and so then i removed which is really sad so what happened to him I'm not going to mention his name is not going to mention the company so it was a company that in the 80s invested a lot of fries a lot of money in actually using authentication to make sure that people who actually go in from outside the network and tried to go in that they're actually authorized and so they used des and other techniques at a time in order to guarantee the authenticity so this company came in financial problems in the 90s and they call the head of this group saying okay you have basically recommending us to implement all the script oh how much did you actually save and so when I teach about intrusion detection I say this includes diction thing although it quite limited is useful because then you can actually use it I actually spoke about it with actually mentioning his name about endurance detection and when you look at how much money has been saved and that is the issue and so he lost not only did he lost his shop but the whole group was fired because he couldn't demonstrate how much money the company had saved so yes this is an important aspect and that's why I think it's sad that that connection not mentioned the name his name and the name of the organization for which he worked I'm actually state what you exactly said yes yes it is you know there are people looking at economic aspects of security and so that's an issue that should be definitely there 
