id,categoryId,description,publishedAt,title,thmbnails,channelTitle,duration,caption,viewCount,likeCount,dislikeCount,favoriteCount,commentCount,subtitle
sM1Iwt7Lfrw,27,"Entropy for a source is defined as the average amount of information per symbol. It is also a measure of uncertainty of the source. In this lecture, we continue with our coverage of discrete-time information sources and present the following topics:
Define the source entropy
Study the entropy of the binary source
Prove that: 0 ≤ H(S) ≤ log2M
. Haykin, Communication Systems, 4th Edition, John Wiley & Sons, 2001 (Chapters 9 and 10)
T. Cover and J. Thomas, Elements of Information Theory, John Wiley & Sons, 2006.
G. A. Jones and J. M. Jones, “Information and Coding Theory,” Springer ISBN 1-85233-622-6, 3rd Edition.
R. W. Hamming, Coding and Information Theory, 2nd Ed., Prentice-Hall Inc.,1986
R. B. Wells, Applied Coding & Information Theory for Engineers, Prentice Hall, NJ 1999.
R. E. Ziemer and W. H. Tranter, Principles of Communications: Systems, Modulation, and Noise, 6th Edition, Hoboken, NJ : Wiley, 2009.
S. M. Moser and P.-N. Chen, A Student’s Guide to Coding and Information Theory, Cambridge, 2012.
Information Theory Class Notes: at http://apal.naist.jp/~kaji/lecture/",2021-04-02T17:56:54Z,L6. Properties of Source Entropy,https://i.ytimg.com/vi/sM1Iwt7Lfrw/hqdefault.jpg,Wael Hashlamoun,PT22M26S,false,65,2,0,0,0,welcome everyone this lecture is about the source entropy this is a brief outline of the lecture first we define the source entropy then we study the entropy of the binary source and finally we prove the important property that the entropy is non-negative and falls between 0 and log base 2 of m where m is the number of symbols in the source alphabet we start as we have started also in previous lectures with our model of a discrete time information source the source under consideration is a discrete time source the number of symbols in the source is finite and countable the source is discrete in time in the sense that it produces one symbol out of the impossible symbols every time unit the output of the source in the first time slot is a random variable x1 the output in the second time slot is another random variable x2 and so on over the source we define a probability distribution p of s equal s sub m equal p sub m that is there is an associated probability for each symbol s i produced by the source s1 is produced with probability p1 s2 is produced with probability p2 and s sub m is produced with probability p sub m in the previous lecture we defined the information content of each symbol in the alphabet using this relationship i of s sub m equal log base 2 1 over p sub m in bits using this definition of information we can say that the information content of symbol s1 is log base 2 1 over p1 that of s2 is log base 2 1 over p2 and that of s sub m is log base 2 1 over p sub m so these are the individual information produced by each one of the symbols s i now we define the average information pair source symbol symbol s1 occurs with probability p1 and carries an amount of information log base 2 1 over p1 symbol s2 occurs with probability p2 and carries an amount of information log base 2 1 over p2 and so on from this we conclude that the information content of each symbol is a random variable and this is the associated probability with this random variable uh this random variable is a discrete one and therefore we can compute the expected value or the average amount of information of this random variable as a product of the probability of occurrence times the amount of information for each symbol this is expressed mathematically as the expected value of the random variable this is also called the entropy of the source and it equals the product of p i times log base 2 1 over p i and the summation is carried out over all symbols in the source so the entropy of the source is given by this formula p i log base 2 1 over p i and the units are in bits pair symbol we have two interpretations for the entropy the first entropy is a measure of the information content in the source as we can see from here it's the expected value of the amount of information in the source and also it's a measure of the uncertainty in the source since information is related to the uncertainty in the source through this relationship one over p i as the probability decreases the uncertainty increases and the amount of information increases so these two properties or these two interpretations are related closely with this definition of the information for each symbol symbols with higher probability have less uncertainty symbols with small probabilities have higher amount of uncertainty that is they carry larger amount of information in the special case when the symbols in the source are equally likely the entropy is given as 1 over m log base 2 of m and this equals log base 2 of n now we consider the binary source consider a random binary source s with probability assignment over its symbols as probability that s equals one equal p probability that s equals to zero is one minus p the entropy of the source is h of p equal minus p which is the probability of 1 log base 2 p minus the probability of a 0 which is 1 minus p log base 2 1 minus p in bit sphere symbol in this figure we plot the entropy function h of p as a function of p which is the probability of one we see that when p equal to zero the entropy is zero when p is one the entropy is zero and when p equals one half the entropy is maximum we also notice that the entropy function is concave upward and attains its maximum value when the symbols are equally probable when p equal to zero this means that symbol one occurs with probability zero in this case zero occurs with probability one at this end one of the symbols occurs with probability one and therefore the source entropy is zero when p equals one also this symbol this symbol occurs with probability one and therefore the entropy is zero h of p equals to zero at p equals to zero and at p equal one and this is emphasized by the fact that one of the symbols occurs with probability one and when one of the symbols occurs with probability one this means that there is no uncertainty in the source which means that the entropy of the source is zero h of p is maximum which equals to one this is the maximum value when p equals one half that is symbols are equally probable this means that when p is one half the source has maximum amount of uncertainty now we prove this lemma for an m area information source the entropy h of s is non-negative and falls between 0 and log base 2 of m m is the number of symbols in the source alphabet the minimum value of the source which is 0 occurs when one of the symbols occurs with probability 1 and the rest with probability 0. the maximum value is attained when symbols are equally probable and the maximum value is given by log base 2 of m we can easily prove that the minimum value of the entropy equals to zero and this is attained when one of the symbols occurs with probability one in this case we can make use of this limit limit as p equals to 0 of p log p which also equals limit as p approaches 1 of p log p and this is equals to zero as we know the entropy of the source is given as minus summation of p i log base 2 of p i when one of the symbols is 1 so we have 1 log base 2 of 1 equal to zero for one symbol and for the rest of the symbols we have zero log base two of zero which is also equals to zero next we show that the entropy is maximum when source probabilities are equal that is when p i equal 1 over m actually we will approve this in two steps but before doing that we introduce what is called the relative entropy d of x and y this is a distance measure between the distribution x and the distribution y uh the divergence or distance between distribution x and distribution y it's defined as d of x and y the distance or the divergence between distribution x and distribution y equals summation from j equal 1 to m p sub j log p sub j over q sub j p sub j is the distribution under consideration for the random variable x q sub j is a reference distribution with probabilities q 1 q q2 up to q sub m of course x is a random variable with the distributions p sub j this is our given probability mass function y is a reference random variable with distribution q sub j first we prove that the divergence d between distributions x and y is non-negative larger than or equal to zero we can rewrite this divergence as d of x and y equal summation p sub j log p sub j over q sub j we can reverse the order for q sub j and p sub j which equals minus p sub j log q we take the minus sign to the opposite side minus d of x and y equal summation p sub j log q sub j divided by p sub j we also know this fact about the logarithmic function that log x is always less than or equal to x minus one this is the curve y equal len x y equal log x and this curve always falls below this straight line y equal x minus 1. this means that this summation p sub j log q sub j over p sub j we can replace this logarithmic term with this quantity which is qg divided by p sub j minus one so this quantity is smaller than or equal to this straight line now we can we can simplify this term as less than or equal to q sub j this term cancels out with this term so we are left with q sub j minus p sub j minus p sub j and we also know that the summation of all probabilities equals to 1 so this summation is 1 this summation is also 1 which means that d of x and y is greater than we can reverse this inequality and therefore we have d of x and y greater than or equal to zero therefore the relative entropy or the divergence between x and y is an a negative quantity of course when these probabilities are equal that is when q sub j equal p sub j this ratio is one and so log one equal to zero this means that the relative entropy between distribution x and distribution y is zero only when p1 equals q1 p2 equals q2 p sub m equals q sub m in this case the distance or the relative entropy equals to zero otherwise the divergence is non-negative it's always greater than or equal to zero so this is the first part in proving that lemma that the divergence d between distributions x and y is non-negative now we come to the second step now we let y be a uniform distribution in this case we have assumed that the reference distribution is a uniform so let y be a uniform distribution in this case the probability for any symbol in this distribution is 1 over m we compute the relative entropy between our distribution x and this reference distribution as d of x and y equals summation p sub j log p sub j over q sub j we can expand this summation as p sub j log p sub j minus p sub j log q sub j we can easily recognize that the first summation is nothing but the negative of the entropy of the source x so this is minus h of x as for the second term we have p sub j log q sub j q sub j equal 1 over m since the symbols in the reference distribution are equally probable so this is p sub j log 1 over m which equals minus h of x minus this is a constant we can take it out of the summation minus log one over m and we are left with the summation of p sub j but again the summation over all probabilities of this distribution p sub j equals 1 therefore d d of x and y equals minus h of x plus log base 2 of m therefore d equals log m minus h of x and we also know the relative entropy d is greater than or equal to zero therefore we conclude that h of x is less than or equal to log base 2 of m so h of x is less than or equal log base 2 of m we also notice that when p sub j equal q sub j when p sub j equals q sub j the value of this logarithm is zero therefore d equal to zero and in this case h of x equals log base two of n otherwise h of x is less than or equal to log base 2 of n to conclude the entropy of a source is a non-negative quantity which falls between 0 and log base 2 of m the minimum value is attained when one of the symbols assumes a probability of 1 and the rest are zeros the maximum value of the entropy is attained when all symbols are equally likely this concludes this lecture 
